{
  "kind": "watchcraft.authoring-capability-registry",
  "schema_version": 1,
  "registry_version": "2026-09-13.1",
  "handlers": [
    {
      "id": "watchcraft.analysis.lexical",
      "version": "1",
      "operation": "generate",
      "inputs": [],
      "dependencies": [],
      "output": {
        "artifact_kind": "analysis",
        "schema": {
          "id": "watchcraft.analysis.lexical",
          "version": 1
        }
      },
      "execution_profile": {
        "id": "python-portable",
        "version": "1"
      },
      "lease_class": "short",
      "retry_policy": {
        "max_attempts": 3,
        "retryable_classifications": [
          "artifact_store_failed",
          "lease_expired"
        ]
      }
    },
    {
      "id": "watchcraft.analysis.educational-video",
      "version": "1",
      "operation": "generate",
      "inputs": [],
      "dependencies": [
        {
          "artifact_kind": "transcript",
          "schema": {
            "id": "watchcraft.transcript",
            "version": 1
          }
        }
      ],
      "output": {
        "artifact_kind": "analysis",
        "schema": {
          "id": "watchcraft.video-analysis",
          "version": 2
        }
      },
      "execution_profile": {
        "id": "python-openai",
        "version": "1"
      },
      "lease_class": "model-api",
      "retry_policy": {
        "max_attempts": 2,
        "retryable_classifications": [
          "analysis_dependency_unavailable",
          "analysis_provider_failed",
          "artifact_store_failed",
          "lease_expired"
        ]
      }
    },
    {
      "id": "watchcraft.resolve.collection-terminology",
      "version": "7",
      "operation": "generate",
      "inputs": [
        {
          "artifact_kind": "terminology-resolution-checkpoint",
          "schema": {
            "id": "watchcraft.terminology-resolution-checkpoint",
            "version": 1
          },
          "cardinality": {
            "minimum": 0,
            "maximum": 1
          }
        }
      ],
      "dependencies": [
        {
          "artifact_kind": "transcript",
          "schema": {
            "id": "watchcraft.transcript",
            "version": 1
          },
          "cardinality": {
            "minimum": 1,
            "maximum": 10000
          }
        },
        {
          "artifact_kind": "analysis",
          "schema": {
            "id": "watchcraft.video-analysis",
            "version": 2
          },
          "cardinality": {
            "minimum": 1,
            "maximum": 10000
          }
        }
      ],
      "output": {
        "artifact_kind": "terminology-resolution",
        "schema": {
          "id": "watchcraft.terminology-resolution",
          "version": 1
        }
      },
      "execution_profile": {
        "id": "python-openai",
        "version": "1"
      },
      "lease_class": "model-api",
      "retry_policy": {
        "max_attempts": 2,
        "retryable_classifications": [
          "terminology_dependency_unavailable",
          "terminology_provider_failed",
          "worker_dependency_unavailable",
          "artifact_store_failed",
          "lease_expired"
        ]
      }
    },
    {
      "id": "watchcraft.normalize.collection-topics",
      "version": "9",
      "operation": "generate",
      "inputs": [
        {
          "artifact_kind": "topic-normalization",
          "schema": {
            "id": "watchcraft.topic-normalization",
            "version": 1
          },
          "cardinality": {
            "minimum": 0,
            "maximum": 1
          }
        }
      ],
      "dependencies": [
        {
          "artifact_kind": "analysis",
          "schema": {
            "id": "watchcraft.video-analysis",
            "version": 2
          },
          "cardinality": {
            "minimum": 1,
            "maximum": 10000
          }
        },
        {
          "artifact_kind": "terminology-resolution",
          "schema": {
            "id": "watchcraft.terminology-resolution",
            "version": 1
          }
        }
      ],
      "output": {
        "artifact_kind": "topic-normalization",
        "schema": {
          "id": "watchcraft.topic-normalization",
          "version": 1
        }
      },
      "execution_profile": {
        "id": "python-openai",
        "version": "1"
      },
      "lease_class": "model-api",
      "retry_policy": {
        "max_attempts": 2,
        "retryable_classifications": [
          "analysis_dependency_unavailable",
          "normalization_provider_failed",
          "artifact_store_failed",
          "lease_expired"
        ]
      }
    },
    {
      "id": "watchcraft.compile.video-collection",
      "version": "7",
      "operation": "compile",
      "inputs": [
        {
          "artifact_kind": "project-processing-plan",
          "schema": {
            "id": "watchcraft.project-processing-plan",
            "version": 1
          }
        },
        {
          "artifact_kind": "collection-iterator-snapshot",
          "schema": {
            "id": "watchcraft.collection-iterator-snapshot",
            "version": 1
          }
        }
      ],
      "dependencies": [
        {
          "artifact_kind": "transcript",
          "schema": {
            "id": "watchcraft.transcript",
            "version": 1
          },
          "cardinality": {
            "minimum": 1,
            "maximum": 10000
          }
        },
        {
          "artifact_kind": "analysis",
          "schema": {
            "id": "watchcraft.video-analysis",
            "version": 2
          },
          "cardinality": {
            "minimum": 1,
            "maximum": 10000
          }
        },
        {
          "artifact_kind": "terminology-resolution",
          "schema": {
            "id": "watchcraft.terminology-resolution",
            "version": 1
          }
        },
        {
          "artifact_kind": "topic-normalization",
          "schema": {
            "id": "watchcraft.topic-normalization",
            "version": 1
          }
        }
      ],
      "output": {
        "artifact_kind": "collection-compilation",
        "schema": {
          "id": "watchcraft.collection-compilation",
          "version": 1
        }
      },
      "execution_profile": {
        "id": "python-portable",
        "version": "1"
      },
      "lease_class": "short",
      "retry_policy": {
        "max_attempts": 3,
        "retryable_classifications": [
          "artifact_store_failed",
          "lease_expired"
        ]
      }
    },
    {
      "id": "watchcraft.iterator.youtube-playlist",
      "version": "1",
      "operation": "generate",
      "inputs": [],
      "dependencies": [],
      "output": {
        "artifact_kind": "collection-iterator-snapshot",
        "schema": {
          "id": "watchcraft.collection-iterator-snapshot",
          "version": 1
        }
      },
      "execution_profile": {
        "id": "python-portable",
        "version": "1"
      },
      "lease_class": "short",
      "retry_policy": {
        "max_attempts": 3,
        "retryable_classifications": [
          "artifact_store_failed",
          "lease_expired",
          "source_discovery_failed"
        ]
      }
    },
    {
      "id": "watchcraft.iterator.explicit-membership",
      "version": "1",
      "operation": "generate",
      "inputs": [],
      "dependencies": [],
      "output": {
        "artifact_kind": "collection-iterator-snapshot",
        "schema": {
          "id": "watchcraft.collection-iterator-snapshot",
          "version": 1
        }
      },
      "execution_profile": {
        "id": "python-portable",
        "version": "1"
      },
      "lease_class": "short",
      "retry_policy": {
        "max_attempts": 3,
        "retryable_classifications": [
          "artifact_store_failed",
          "lease_expired"
        ]
      }
    },
    {
      "id": "watchcraft.planner.video-collection",
      "version": "2",
      "operation": "generate",
      "inputs": [
        {
          "artifact_kind": "collection-iterator-snapshot",
          "schema": {
            "id": "watchcraft.collection-iterator-snapshot",
            "version": 1
          }
        }
      ],
      "dependencies": [],
      "output": {
        "artifact_kind": "project-processing-plan",
        "schema": {
          "id": "watchcraft.project-processing-plan",
          "version": 1
        }
      },
      "execution_profile": {
        "id": "python-portable",
        "version": "1"
      },
      "lease_class": "short",
      "retry_policy": {
        "max_attempts": 3,
        "retryable_classifications": [
          "artifact_store_failed",
          "lease_expired",
          "source_input_unavailable"
        ]
      }
    },
    {
      "id": "watchcraft.transcript.mlx-whisper-smoke",
      "version": "1",
      "operation": "generate",
      "inputs": [],
      "dependencies": [],
      "output": {
        "artifact_kind": "transcript",
        "schema": {
          "id": "watchcraft.transcript",
          "version": 1
        }
      },
      "execution_profile": {
        "id": "macos-mlx",
        "version": "1"
      },
      "lease_class": "accelerated",
      "retry_policy": {
        "max_attempts": 2,
        "retryable_classifications": [
          "artifact_store_failed",
          "lease_expired"
        ]
      }
    },
    {
      "id": "watchcraft.transcript.mlx-whisper-http-smoke",
      "version": "1",
      "operation": "generate",
      "inputs": [],
      "dependencies": [],
      "output": {
        "artifact_kind": "transcript",
        "schema": {
          "id": "watchcraft.transcript",
          "version": 1
        }
      },
      "execution_profile": {
        "id": "macos-mlx",
        "version": "1"
      },
      "lease_class": "accelerated",
      "retry_policy": {
        "max_attempts": 2,